Reference,MLA_reference
"Zilhão, 2021","Zilhão, João. “New Evidence from Galeria Da Cisterna (Almonda) and Gruta Do Caldeirão on the Phasing of Central Portugal’s Early Neolithic.” Open Archaeology, vol. 7, no. 1, 2021, pp. 747–64, doi:doi:10.1515/opar-2020-0163."
Alves et al.2010,"Alves, Catarina, et al. “Hipogeos Funerarios Del Bronce Pleno En Torre Velha 3 (Serpa, Portugal).” Zephyrus, vol. 66, no. 1, Ediciones Universidad de Salamanca (España), 2010, pp. 133–53, http://hdl.handle.net/10366/130385."
Valério et al. 2014,"Valério, Pedro, et al. “Arsenical Copper and Bronze in Middle Bronze Age Burial Sites of Southern Portugal: The First Bronzes in Southwestern Iberia.” Journal of Archaeological Science, vol. 42, 2014, pp. 68–80, doi:https://doi.org/10.1016/j.jas.2013.10.039."
Soares et al. 2009,"Soares, António M. Monge, et al. “Práticas Rituais No Bronze Do Sudoeste - Alguns Dados.” Estudos Arqueológicos de Oeiras, vol. 17, 2009, pp. 433–56."
"Serrano and González, 2009","Serrano, Juan Antonio Cámara, and Fernando Molina González. “El Análisis de La Ideología de Emulación. El Caso de El Argar.” Cuadernos de Prehistoria y Arqueología de La Universidad de Granada, vol. 19, Juan Antonio Cámara Serrano, 2009, pp. 163–94, doi:10.30827/cpag.v19i0.188."
Jiménez et al. 2008,"Jiménez, Gonzalo Aranda, et al. “El Poblado y Necrópolis Argáricos Del Cerro de La Encina (Monachil, Granada). Las Campañas de Excavación de 2003-05.” Cuadernos de Prehistoria y Arqueología de La Universidad de Granada, vol. 18, 2008, pp. 219–64."
Mataloto et al. 2013,"Mataloto, Rui, et al. “Cronologia Absoluta Para o Bronze Do Sudoeste. Periodização, Base de Dados, Tratamento Estatístico.” Estudos Arqueológicos de Oeiras, vol. 20, no. 1, 2013, pp. 303–38."
Silva et al. 2021,"Silva, Ana Maria, et al. “A Closer Look at the Forgotten Bones of the Dolmen of Pedras Grandes (Odivelas, Portugal).(Examining Old Human Remains 7).” SPAL-Revista de Prehistoria y Arqueología, no. 30.2, 2021, pp. 20–46."
